{
  "code": "9651742898673848748872",
  "expiration_date": "2022-03-10",
  "pet": 0,
  "newPet": {
    "name": "Belle",
    "date_of_birth": "2019-08-20",
    "sex": "Samica",
    "species": "pies",
    "additional_information": "Labrador retriever biszkoptowa sierść",
    "owner": 0,
    "newOwner": {
      "first_name": "Joanna",
      "last_name": "Slyszewska",
      "email": "joannaslyszewska1502@gmail.com",
      "phone_number": "+48 666 666 666"
    }
  },
  "cures": [
    {
      "cure": 2,
      "quantity": 10,
      "quantity_type": "sz."
    }
  ]
}